{
  "schema_version": "task1-variant-recipes/v0.1",
  "recipe_set_id": "riskchainbench-task1-six-variant-v0.1",
  "primary_variant_index": 0,
  "variants": [
    {
      "variant_index": 0,
      "recipe_id": "primary-composite-medium",
      "family": "COMPOSITE",
      "difficulty": "MEDIUM",
      "primary_for_e2e": true,
      "description": "Frozen primary variant used for Task 1 to Task 2 end-to-end evaluation.",
      "overrides": {}
    },
    {
      "variant_index": 1,
      "recipe_id": "composite-replicate-medium",
      "family": "COMPOSITE",
      "difficulty": "MEDIUM",
      "primary_for_e2e": false,
      "description": "Independent deterministic draw under the primary composite policy.",
      "overrides": {}
    },
    {
      "variant_index": 2,
      "recipe_id": "entry-confusable-focused",
      "family": "ENTRY_CONFUSABLE",
      "difficulty": "EASY",
      "primary_for_e2e": false,
      "description": "Isolates Unicode entry reconstruction without lexical or emoji noise.",
      "overrides": {
        "homophone_probability_scale": 0,
        "emoji_insertion_probability": 0,
        "emoji_min_insertions": 0,
        "emoji_max_insertions": 0,
        "emoji_line_break_probability": 0
      }
    },
    {
      "variant_index": 3,
      "recipe_id": "lexical-platform-focused",
      "family": "LEXICAL_PLATFORM",
      "difficulty": "MEDIUM",
      "primary_for_e2e": false,
      "description": "Combines lexical substitutions with moderate platform-token noise while leaving the entry surface unchanged.",
      "overrides": {
        "entry_replacement_probability": 0,
        "entry_minimum_replacements": 0,
        "emoji_insertion_probability": 0.55,
        "emoji_min_insertions": 3,
        "emoji_max_insertions": 10,
        "emoji_line_break_probability": 0.05
      }
    },
    {
      "variant_index": 4,
      "recipe_id": "layout-stress-hard",
      "family": "LAYOUT_STRESS",
      "difficulty": "HARD",
      "primary_for_e2e": false,
      "description": "Stresses dense platform-token insertion and cross-line layout with limited lexical and entry perturbation.",
      "overrides": {
        "homophone_probability_scale": 0.35,
        "entry_replacement_probability": 0.35,
        "entry_minimum_replacements": 1,
        "emoji_insertion_probability": 0.95,
        "emoji_min_insertions": 12,
        "emoji_max_insertions": 28,
        "emoji_line_break_probability": 0.35,
        "emoji_chunk_min_characters": 1,
        "emoji_chunk_max_characters": 2
      }
    },
    {
      "variant_index": 5,
      "recipe_id": "hard-composite",
      "family": "COMPOSITE",
      "difficulty": "HARD",
      "primary_for_e2e": false,
      "description": "Applies strong lexical, entry-confusable, platform-token, and line-break transformations together.",
      "overrides": {
        "homophone_probability_scale": 1,
        "entry_replacement_probability": 0.92,
        "entry_minimum_replacements": 4,
        "emoji_insertion_probability": 0.9,
        "emoji_min_insertions": 10,
        "emoji_max_insertions": 28,
        "emoji_line_break_probability": 0.25,
        "emoji_chunk_min_characters": 1,
        "emoji_chunk_max_characters": 2
      }
    }
  ]
}
